{
  "schemaVersion": "2.0.0",
  "tenant": "shaw",
  "clientSafe": true,
  "asOf": "2026-07-16",
  "emails": [
    {
      "id": "19f61baf4fd6117e",
      "from": "Justin Gann <jgann@shawsystems.com>",
      "to": "Justin Brannon <justinbrannon95@gmail.com>",
      "subject": "Re: Teams Meeting Transcription",
      "date": "Tue, 14 Jul 2026 17:43:44 +0000",
      "timestamp": 1784051024000,
      "dateLabel": "Jul 14, 2026",
      "snippet": "[cid:9b885ff8-8de2-4344-b4cc-d34d2c07023a] Justin Gann Senior Vice President, Sales & Marketing Mobile: 281-610-4461 | www.shawsystems.com 10111 Richmond Ave, Suite 600 | Houston, TX 77042 REGISTER NOW <[link removed] | Shaw Systems Conference | April 29 – May 1, 2026 The information in this e-mail ",
      "preview": "[cid:9b885ff8-8de2-4344-b4cc-d34d2c07023a] Justin Gann Senior Vice President, Sales & Marketing",
      "contactLabel": "Justin Gann + Emily"
    },
    {
      "id": "19f61aa23bd875cf",
      "from": "Justin Brannon <justinbrannon95@gmail.com>",
      "to": "Justin Gann <jgann@shawsystems.com>",
      "subject": "Teams Meeting Transcription",
      "date": "Tue, 14 Jul 2026 12:26:07 -0500",
      "timestamp": 1784049967000,
      "dateLabel": "Jul 14, 2026",
      "snippet": "Hey Joe, Could I please have the meeting transcription? I guess it was joining me as a guest instead of under my Shaw teams account. I'll make sure that I'm joining with the right account from now on. Thanks, Justin Brannon",
      "preview": "Hey Joe, Could I please have the meeting transcription? I guess it was joining me as a guest instead of under my Shaw teams",
      "contactLabel": "Justin Gann + Emily"
    },
    {
      "id": "19f5c504c2691429",
      "from": "Justin Gann <jgann@shawsystems.com>",
      "to": "Justin Brannon <justinbrannon95@gmail.com>",
      "subject": "Re: Amplify Video Update + Meeting Early Next Week",
      "date": "Mon, 13 Jul 2026 16:29:41 +0000",
      "timestamp": 1783960181000,
      "dateLabel": "Jul 13, 2026",
      "snippet": "Thanks. Does 11 tomorrow work? [cid:c515ee3f-bea8-4303-b989-6073faec278d] Justin Gann Senior Vice President, Sales & Marketing Mobile: 281-610-4461 | www.shawsystems.com 10111 Richmond Ave, Suite 600 | Houston, TX 77042 REGISTER NOW <[link removed] | Shaw Systems Conference | April 29 – May 1, 2026 ",
      "preview": "Thanks. Does 11 tomorrow work? [cid:c515ee3f-bea8-4303-b989-6073faec278d]",
      "contactLabel": "Justin Gann + Emily"
    }
  ],
  "meetings": [
    {
      "id": "_60q30c1g60o30e1i60o4ac1g60rj8gpl88rj2c1h84s34h9g60s30c1g60o30c1g6crj8ci16orjghho64p48h1g64o30c1g60o30c1g60o30c1g60o32c1g60o30c1g6sp34ha38p1jaca368r4cchk6h0jaghg74rkac9g71232c1p711g",
      "summary": "Internal: AI Video Meeting",
      "start": "2026-07-14T11:00:00-05:00",
      "end": "2026-07-14T12:00:00-05:00",
      "startLabel": "Tue, Jul 14, 11:00 AM CDT",
      "endLabel": "Tue, Jul 14, 12:00 PM CDT",
      "location": "Microsoft Teams Meeting",
      "attendees": [
        "justinbrannon95@gmail.com",
        "eagnolucci@shawsystems.com",
        "chwestern@shawsystems.com",
        "jgann@shawsystems.com"
      ],
      "upcoming": false,
      "contactLabel": "Shaw team"
    },
    {
      "id": "_60q30c1g60o30e1i60o4ac1g60rj8gpl88rj2c1h84s34h9g60s30c1g60o30c1g8crk8gq36d138ghi60s48h1g64o30c1g60o30c1g60o30c1g60o32c1g60o30c1g8crj4ha38crj6c236gsj6ghk68sk8d9l64o3idhn6p1kada68ko0",
      "summary": "Amplify Video Review",
      "start": "2026-07-01T10:00:00-05:00",
      "end": "2026-07-01T11:00:00-05:00",
      "startLabel": "Wed, Jul 1, 10:00 AM CDT",
      "endLabel": "Wed, Jul 1, 11:00 AM CDT",
      "location": "Microsoft Teams Meeting",
      "attendees": [
        "justinbrannon95@gmail.com",
        "eagnolucci@shawsystems.com",
        "jgann@shawsystems.com"
      ],
      "upcoming": false,
      "contactLabel": "Justin Gann"
    },
    {
      "id": "_60q30c1g60o30e1i60o4ac1g60rj8gpl88rj2c1h84s34h9g60s30c1g60o30c1g64o4acpn74sjegph6sq48gpg64o30c1g60o30c1g60o30c1g60o32c1g60o30c1g8go36gi36sokcd1g8p1kcchk6t134h9k6l2k2e1g88o48di46cr0_20260615T140000Z",
      "summary": "FW: Internal: Weekly Marketing Meeting",
      "start": "2026-06-17T10:30:00-05:00",
      "end": "2026-06-17T11:30:00-05:00",
      "startLabel": "Wed, Jun 17, 10:30 AM CDT",
      "endLabel": "Wed, Jun 17, 11:30 AM CDT",
      "location": "Microsoft Teams Meeting",
      "attendees": [
        "justinbrannon95@gmail.com",
        "eagnolucci@shawsystems.com",
        "chwestern@shawsystems.com",
        "jgann@shawsystems.com"
      ],
      "upcoming": false,
      "contactLabel": "Justin Gann + Emily"
    },
    {
      "id": "_60q30c1g60o30e1i60o4ac1g60rj8gpl88rj2c1h84s34h9g60s30c1g60o30c1g64o4acpn74sjegph6sq48gpg64o30c1g60o30c1g60o30c1g60o32c1g60o30c1g8go36gi36sokcd1g8p1kcchk6t134h9k6l2k2e1g88o48di46cr0_20260608T140000Z",
      "summary": "Internal: Weekly Marketing Meeting",
      "start": "2026-06-09T10:00:00-05:00",
      "end": "2026-06-09T11:30:00-05:00",
      "startLabel": "Tue, Jun 9, 10:00 AM CDT",
      "endLabel": "Tue, Jun 9, 11:30 AM CDT",
      "location": "Microsoft Teams Meeting",
      "attendees": [
        "justinbrannon95@gmail.com",
        "eagnolucci@shawsystems.com",
        "chwestern@shawsystems.com",
        "jgann@shawsystems.com"
      ],
      "upcoming": false,
      "contactLabel": "Justin Gann"
    },
    {
      "id": "_60q30c1g60o30e1i60o4ac1g60rj8gpl88rj2c1h84s34h9g60s30c1g60o30c1g6l2jigq36krkcc228oqk8gpg64o30c1g60o30c1g60o30c1g60o32c1g60o30c1g74pjgdq26t130chk8h1jccpk6ssjic238gr44ci16t0jcdi16920",
      "summary": "Amplify Video Discussion",
      "start": "2026-06-08T12:00:00-05:00",
      "end": "2026-06-08T13:00:00-05:00",
      "startLabel": "Mon, Jun 8, 12:00 PM CDT",
      "endLabel": "Mon, Jun 8, 1:00 PM CDT",
      "location": "Microsoft Teams Meeting",
      "attendees": [
        "justinbrannon95@gmail.com",
        "eagnolucci@shawsystems.com",
        "jbrannon@shawsystems.com",
        "jgann@shawsystems.com",
        "mmoore@shawsystems.com"
      ],
      "upcoming": false,
      "contactLabel": "Justin Gann"
    },
    {
      "id": "_60q30c1g60o30e1i60o4ac1g60rj8gpl88rj2c1h84s34h9g60s30c1g60o30c1g6cp32h216oo48d9m8l348gpg64o30c1g60o30c1g60o30c1g60o32c1g60o30c1g88r34ea66sr4aca38crkch9k690j0d1o85132d1i6h246dpn6os0",
      "summary": "Amplify Video",
      "start": "2026-06-01T13:00:00-05:00",
      "end": "2026-06-01T13:30:00-05:00",
      "startLabel": "Mon, Jun 1, 1:00 PM CDT",
      "endLabel": "Mon, Jun 1, 1:30 PM CDT",
      "location": "Microsoft Teams Meeting",
      "attendees": [
        "justinbrannon95@gmail.com",
        "jgann@shawsystems.com"
      ],
      "upcoming": false,
      "contactLabel": "Justin Gann"
    },
    {
      "id": "_60q30c1g60o30e1i60o4ac1g60rj8gpl88rj2c1h84s34h9g60s30c1g60o30c1g6h14cdq26orj6g9l8ks48gpg64o30c1g60o30c1g60o30c1g60o32c1g60o30c1g8533gg9l64q3gdpo8h2kcd1k8p0j6c9j712k8cpn64s46ea370pg",
      "summary": "Justin & Justin Touchbase",
      "start": "2026-05-22T09:00:00-05:00",
      "end": "2026-05-22T10:00:00-05:00",
      "startLabel": "Fri, May 22, 9:00 AM CDT",
      "endLabel": "Fri, May 22, 10:00 AM CDT",
      "location": "Microsoft Teams Meeting",
      "attendees": [
        "justinbrannon95@gmail.com",
        "jgann@shawsystems.com"
      ],
      "upcoming": false,
      "contactLabel": "Justin Gann"
    },
    {
      "id": "_60q30c1g60o30e1i60o4ac1g60rj8gpl88rj2c1h84s34h9g60s30c1g60o30c1g84pk2cq16t2k8gq68h1k8gpg64o30c1g60o30c1g60o30c1g60o32c1g60o30c1g8crkadpj8d13ce9h710jcd9k8gs30gph8gq3cd1g6p142h9m6p20",
      "summary": "Internal: Justin & Justin Go-Forward",
      "start": "2026-05-06T14:00:00-05:00",
      "end": "2026-05-06T14:30:00-05:00",
      "startLabel": "Wed, May 6, 2:00 PM CDT",
      "endLabel": "Wed, May 6, 2:30 PM CDT",
      "location": "Microsoft Teams Meeting",
      "attendees": [
        "justinbrannon95@gmail.com",
        "jgann@shawsystems.com"
      ],
      "upcoming": false,
      "contactLabel": "Justin Gann"
    },
    {
      "id": "_60q30c1g60o30e1i60o4ac1g60rj8gpl88rj2c1h84s34h9g60s30c1g60o30c1g6srk2gpm8gsj8h1i89148gpg64o30c1g60o30c1g60o30c1g60o32c1g60o30c1g711jgg9k7133ah1k891j6ghk6ksjagi18p2k2h1o74rj8h9m6opg",
      "summary": "Review AI Video",
      "start": "2026-03-24T16:10:00-05:00",
      "end": "2026-03-24T16:35:00-05:00",
      "startLabel": "Tue, Mar 24, 4:10 PM CDT",
      "endLabel": "Tue, Mar 24, 4:35 PM CDT",
      "location": "Microsoft Teams Meeting",
      "attendees": [
        "justinbrannon95@gmail.com",
        "jgann@shawsystems.com",
        "sbrannon@shawsystems.com"
      ],
      "upcoming": false,
      "contactLabel": "Justin Gann"
    }
  ],
  "source": "Sanitized Gmail and Google Calendar summaries from the owner OS snapshot"
}
